{
  "$schema": "https://harnessprotocol.io/schema/v2/exchange.schema.json",
  "version": "1",
  "type": "offer",
  "sender": {
    "key": "a3f1e2b4c5d6e7f8a9b0c1d2e3f4a5b6c7d8e9f0a1b2c3d4e5f6a7b8c9d0e1f2",
    "display": "alice"
  },
  "message": "Here's the postgres MCP config I mentioned — adjust DB_CONNECTION_STRING for your replica.",
  "fragment": {
    "version": "1",
    "kind": "fragment",
    "metadata": {
      "name": "postgres-mcp",
      "description": "PostgreSQL MCP server via uvx mcp-server-postgres"
    },
    "mcp-servers": {
      "postgres": {
        "transport": "stdio",
        "command": "uvx",
        "args": ["mcp-server-postgres", "--connection-string", "${DB_CONNECTION_STRING}"]
      }
    },
    "env": [
      {
        "name": "DB_CONNECTION_STRING",
        "description": "PostgreSQL connection string",
        "required": true,
        "sensitive": true
      }
    ],
    "instructions": {
      "import-mode": "skip"
    }
  },
  "suggested-import-mode": "merge",
  "expires": "2026-07-01T00:00:00Z",
  "signature": "a3f1e2b4c5d6e7f8a9b0c1d2e3f4a5b6c7d8e9f0a1b2c3d4e5f6a7b8c9d0e1f20f1e2d3c4b5a69788796a5b4c3d2e1f00112233445566778899aabbccddeeff0"
}
