{
  "$schema": "https://harnessprotocol.io/schema/v2/exchange.schema.json",
  "version": "1",
  "type": "offer",
  "sender": {
    "key": "a3f1e2b4c5d6e7f8a9b0c1d2e3f4a5b6c7d8e9f0a1b2c3d4e5f6a7b8c9d0e1f2",
    "display": "alice"
  },
  "recipient": {
    "key": "0f1e2d3c4b5a69788796a5b4c3d2e1f00112233445566778899aabbccddeeff0"
  },
  "message": "Encrypted to your key, as you asked.",
  "encrypted-fragment": {
    "algorithm": "x25519-xsalsa20-poly1305",
    "nonce": "T3hQc2V1ZG9Ob25jZTI0Qnl0ZXNYWFhY",
    "ciphertext": "U29tZUVuY3J5cHRlZEZyYWdtZW50Qnl0ZXNUaGF0RGVjcnlwdFRvQVZhbGlkRnJhZ21lbnQ9"
  },
  "suggested-import-mode": "merge",
  "expires": "2026-07-01T00:00:00Z",
  "signature": "0f1e2d3c4b5a69788796a5b4c3d2e1f00112233445566778899aabbccddeeff0a3f1e2b4c5d6e7f8a9b0c1d2e3f4a5b6c7d8e9f0a1b2c3d4e5f6a7b8c9d0e1f2"
}
